label	txt
1	手机很好 6.95比我想象得要大 充电也很快续航不错 客服也很好就是物流太慢了点 可能是我正好赶上台风山竹吧
1	手机是正版，安兔兔跑分21万，屏幕没有别人说的那么难受，总的来说很好，还能分屏和指关节截屏，不错的
0	明是蓝色，非说是紫
-1	产品用起有点卡    不是非常好用     本来说支持国产的     非常后悔
1	商家服务态度好，发货快，电话质量没个说，绝对正品。
1	手机不错拼购买的照相不怎么样整体还可以
-1	之前我是荣耀铁粉，买了这款手机我犹豫了，时不时的卡上两下，希望我手机以后少卡两下吧
1	新手机用着就是不一样
1	一直都挺喜欢华为的，荣耀10虽然有点差强人意但是还是挺好的
1	物流很快，荣耀品质，支持华为，第四个华为手机了，一直没抢到V20，只好用荣耀10了。
1	快递用泡沫包裹的很好，盒子都很完整，手机很好看，一直都想买这款手机，不卡机，运营速度也超棒
1	不错，在京东买东西总是很放心的。
1	不错，东西刚到就试了一下，运行流畅不卡顿，渐变色很漂亮很满意
1	还行，目前看可以，效果不错
1	屏幕显示像素高，色彩鲜艳，外观不错，镜头的像素高，不过拍夜景的时候白点好多，比原来用的P9的镜头还是有点差距哦。希望华为越做越好。
1	手机靠谱，好用
1	收到货了，还没用，但看起来还不错
1	手机手感很好，拍照超棒，很清晰，手机各个性能也都十分好哦
1	很好用，速度快，暂时没有问题
0	这款荣耀一零手机，第一时间抢购到，使用了十几天，有如下感受，第一，比荣耀v10在重量上轻得多，在尺寸上小了一圈，在电量上也稍微少了一点。第二，手机背板的颜色有创新，但有一个问题就是京东页面上手机颜色标错了，幻影蓝和幻影紫两个图片正好搞反了，结果是受到了误导，买错了！第三，这款手机跑分在鲁大师排行榜的前列，AI跑分也名列前茅，使用时也感觉开机关机非常快，照相也相当智能。第四，存在一些小毛病，比如说刘海问题，还有相机镜头突出问题，只要使用时注意一下，都不算个事！总之，我们希望华为手机能越做越好！
1	很好?，用了几天，手机挺给力，满意，好评！感谢店主的慷慨赠送。
1	手机太美了
1	第一天下午下单，第二天晚上到的，比起自营来也不算慢了，商家发货速度没的说。荣耀10手机还是很不错的，如果平时游戏需求小算是个很不错的选择。颜值也很高，至于流传的发热问题目前还没遇到，期待手机后续的表现。
1	手机不错，物流超级给力，很担心受山竹影响耽误签收时间，结果两天就到了，很满意，支持国产华为
-1	京东物流奇葩啊！送错地方了放了一天以后告知我还得2天，我这个郁闷啊北京室内要等3天这还不算路上的3天!最后不能忍了我自己叫闪送取回来的。另外商家也没有给发票。反正是一次非常不爽的购物体验
1	这个手机挺好的，数据流量都是自带的，不用插内存卡，外壳是蓝色的，屏幕可以自动换颜色，我弄了一个指纹解锁，和一个密码解锁。使用者的真是感受，总体上对荣耀10还是很满意的，毕竟挑选了很久，直接上顶配，干脆利落
1	东西已经收到，京东物流就是给力，非常快。
1	现在正在用，很喜欢，在众多大屏手机中找到了一个6英寸以下的，拿着很舒服
-1	*GT游戏加速手机，慢得要死，浏览网页也慢，还不如老子摔坏屏的另外一部华为。找了售后然后售后让我找这找那，我可没那么多时间。这商家是不是卖的翻新机会是问题机有待考证！
1	买手机就到京东！哈哈，我不是做~的～前些天给妈妈买了个手机荣耀9，然后给老公买了个荣耀10。京东的电子产品还是让我比较放心的，华为的手机更是我的最爱！支持国产！
1	0号下订单今天才到，有史以来最慢的一次快递，看新手机的份上我忍了，手机很漂亮，刚刚弄了下，屏幕比其他机型窄一点，拍照很厉害，界面很流畅，游戏还没玩，忠实花粉，6年时间从8812到8816，4x，麦芒2，6x到现在的荣耀10，用一段时间再看
1	一直都喜欢荣耀手机，颜值高，性能也好
0	一般般啦
1	不错挺好用
-1	为啥我买的时候不送VR眼镜，今天朋友买的时候就送了
1	没话说，凑够数。很好，值得拥有
1	质量不错，手机很好用，手机运行速度很快，还赠送好多东西，比实体店优惠很多！
1	色装好，手机很漂亮，试用了几天平时使用完全不卡，还能吃?
1	这手机还可以
1	屏够大！网速快！十分喜欢！赞！
-1	说实话真的不咋地，各种不好
-1	也就这样吧
0	华为的手机屏幕真的是不适合打*战游戏，操作出现各种滑屏，屏幕滑不动等难受问题。其它方面表现可以，性价比好，质量一直可以。最大的缺点是续航能力与屏幕问题。
1	好用，流畅，各项功能正常
-1	事实证明钢化玻璃膜并没什么用！
-1	听筒音质不好，滋啦滋啦。
-1	AI相机功能就是个摆设，不用比用的效果好，没用几天就网速超级慢了，发热，玩个游戏烫的不行，指关节功能在贴上手机钢化膜之后也成了摆设，相机拍照效果时好时坏，这几年一直用国产，之前用的OPPO，觉着还行，第一次用华为手机，以后应该不会再用了
1	还没怎么用，等用户会再说
1	收到手机了，真的是很开心。赠品也很给力，特别喜欢，好像手环没有充电器，那没电怎么办啊？急，在线解决
-1	拍照和指纹解锁挺好的就是电池不耐用
1	用了两个星期，总体感觉是很棒的，打游戏非常爽，视野范围比别的手机宽大约2个指头，音质也很棒，面部识别非常快，拍人很美，电池还可以，发热情况也属于正常范畴，但是拍景不真实，指纹识别不太好用。
1	今天收到了货。外观很好看，手机上网速度也很快。
0	不错哦  流畅呢
1	发的顺丰快递，两天就到了。查了一下是正品。送的蓝牙音箱也好看?。
0	用了十来天，看这腾讯新闻图片，手机像素点比较明显，特别是碰见分辨率小的图片和视频越是明显。手机倒是很好看，硬件对得起2600。
1	正在用起来用起来感觉还不错吧，下次换手机不知道是什么时候了
1	手机不错，运行很快。
1	这是给同事买的，我买的也是这个品牌的，感觉不错，就推荐同事也买了一部，他是黑色的。
1	手机很好，玩游戏很流畅，过地图不卡，3d游戏没有压力，玩久了也不烫手，感谢服务员小仙女很细心的介绍，特别玩了几天才来评价，拍照没有时间过几天拍了再上传
1	快递很快，昨天晚上买的今天上午就到了，实物还没用，用过后再来评价
1	包装得很好，实物也很好看。
1	手机挺好用的，就是屏有点小，送的东西都不怎么好，就手机壳还好，送了两个
1	物流很快，服务一流，很好，手机很好，拍照很好
1	手机收到了，非常奶思。物流贼快，客服人很好呢，之前说把游戏手柄换成自拍杆，但发的还是游戏手柄，联系客服，客服说补发。紫色真的很漂亮，手机大小也很适合女生用，送的钢化膜很合适。总之很喜欢，用一段时间再来追评吧
1	这款手机，确实很不错，颜色各方面太喜欢了
1	屏大，还没有使用，应该是不错的。
1	美滋滋啊，手机没的说，店家很好，物流也给力，赞！
1	还好，还好?支持国产
1	持国货，支持华为。喜欢，速度很快，买
1	手机很流畅，音质很好，听歌的时候感觉不错。
1	手感很好的一部手机，虽然不玩游戏，但开视频和拍照都不错，大瓶幕，分屏显示也很爽，让分屏有了价值，支持投影和打印，商务办公方便。电池耐用，一部电影耗电不到30%，非游戏迷日常使用可以两天一充。京东活动比华为官网便宜400元，还送很多东西，京东质量有保障，可放心购买。
1	用了半个月才来评价！总体用着很不错！就是物流稍微有点慢！商家还是很不错的！服务态度特别好！
0	用了几天，电池是真不耐用，超级快充也得一个多小时才能充满
-1	玩游戏不流畅，试了好几款游戏都是这个样子就这还游戏加速手机呢，呵呵了
-1	手机电池不怎么耐用，运行速度慢，没有达到期望值，闹心。
1	华为荣耀，特别好用，支持华为，支持国产。
1	手机男人用有点小，运行感觉触屏没有那么灵敏，感觉挺麻烦，这次去三峡拍照，拍风景还不错，将就用吧
0	荣耀10看起来还是蛮好看的配置也比较高，有时候玩会卡死！总结来说还行吧
1	速度不错，拍照很漂亮。超级喜欢拍照模式。
1	物流是京东的，速度很快，使用了一段时间后才来评价，真的很好使用，上网玩游戏一点都不卡，速度很快，整理外观很好看，背面还会变色，电池非常耐用，有快速充电，好评
0	试玩一下  才发现相机打开黑，无反应很伤心。
0	速度手感都可以，屏幕清晰度不够，总感觉看不清东西。
1	很好的产品，相信华为，商家服务也很周到，送礼很多东西，值得。
1	手机很漂亮，用的挺顺手的，不错！
1	手机手感非常棒，屏幕显示也非常清晰，信号我感觉比我上一部荣耀8要好的多，价格实惠，店家送的赠品也足够多，非常满意的一次购物。中间发生的小插曲，我在集团总部顺丰居然第一次邮递到子公司去了，不过马上又投递过来，耽误了半天时间，看在快递小哥态度好而且确实够辛苦，给全五分吧。
1	性能非常好，如果价格能外便宜一点就好了
0	第一次买华为手机抱着希望体检一把没想到网络延迟了太严重其他方面还可以
1	好，不错，非常实用，我很喜欢
-1	刚买一个星期就降价
1	挺好的，就是有点厚，然后还有点重，其他没有
1	非常喜欢这个大屏幕还有人脸识别 还有指纹识别 都好快 希望系统速度不要下降
-1	给别人卖的不知道怎样
0	忘记发赠品了。咨询客服说给补发
1	手机收到了很好用，放在家里了内没能发图片很好看值得拥有
1	运行流程，前后摄像头均拍照效果清晰，物流快颜值高，值得入手。
1	电池超级给力啊哈哈，平时不玩游戏，随便下载了几个游戏玩玩，体验还好。大屏看视频玩游戏爽～
1	商品挺不错，手感性能都很好，客服服务态度也很好物流也很快。
1	今天刚刚到手  单手大小很合适  喜欢小屏的机友们  强烈推荐  现在很期待到月底升级那个很吓人的技术  刚刚跑完分在21万以上
1	试用中，暂时未有不适感，后续使用体验再细评，
1	还不错，很喜欢，内存大
1	错的选择，运行速度超快屏幕很清晰，待机时间长！?
1	非常满意，外型美观，手感很棒，内存容量大一点都不卡了！
0	没针，是否为假
-1	机感觉一般般，买完就降价了，还不能保价。
1	商品很好，很喜欢！服务特别好！
1	手机还可以，支持华为
-1	不愧是裸机，裸的玲离尽致，你除了裸机以外你不可以推出可以买耳机和手机的套餐嘛，色非。     在下，吴亦凡告辞
1	国庆期间京东的送货还是很快，收到的东西如图。手机尺寸与以前5.2寸的差不多，要再小一点就好了。外观还是可以，两边的黑边有点宽。除了nfc外还有红外功能。速度还没测，新机流畅，如果是ddr4与ufs2.1的话。
1	买给老婆用的，用着还不错，老婆很喜欢
1	手机很高端大气上档次，玩起来也挺顺手的。拍照很清晰。赞一个
0	买了也用了两天了，屏幕有时候会无缘无故的失灵一下，也不知道是啥原因，快递还是可以的，早上下单下午就送到了
0	手机的颜值还是挺高的 感觉还可以 就是手机页面有时会滑不动 卡在那里 体验感不是很好  真的很喜欢华为的手机 心里期待还是挺大的 但失望也会比较大
1	手机用着还不错
-1	我没收到手机。直接收货。16号下单。22号我看了还在县里。从省会发下来。昆明到市区。再到县城。能送10天。真的可以！
1	外观漂亮，音质超好，清晰度高，喜欢华为，支持华为
1	手机不错，卖给老妈，老妈很喜欢，我也很开心
1	刚收到机子     用着不错       物流也很快    好评
0	感觉跟荣耀8青春版用了半年的运行速度差不多
1	商品质量很好和描述相符。
1	黑色很漂亮，大小合适，手感很好，单手超作，性价比也不错！
1	相信京东，是正品，质量很不错，价格便宜，以后还来买！
-1	发布的时候抢的荣耀10  本来满心欢喜的 说说用后感 照相功能比较不错 王者从昨天开始出现屏幕闪 返回键 很不灵敏  最后不爽的  是客服的反应  一切问题都是顾客的 这是支持国产的结果
1	挺好用，就是有点烫手
1	东西是正品，手机也很给力，华为手机值得推荐
1	6G处理，128G内存不玩比较大的手游够用了。用了一段时间感觉还不错，充电也比较快！
1	刚到手速度很快，电池非常给力
1	机很喜欢?！也很好用。个价值了。
1	包装完整！赠品也很好！刚刚拿到，试用了一晚，流畅度很不错，拍照能力很强，不知是视觉原因还是咋地，总感觉拍照比其他手机拍照色彩亮度强很多。指纹触碰没后方手机的灵敏，这是第一次用前置指纹的，可能还不习惯！对于荣耀10等了很久，不管是外观还是性价比，在这个价位绝对值得选择！后两张是10拍摄的
1	用了几天，挺好的。一直用华为，支持国产。
1	级好呀，主要是买来玩游戏用的，王者荣耀绝地求生真的玩的无敌爽，而且手机也不烫，主要颜值特别高啊，自己配了个黑色磨砂的套就无敌好看啦，就喜欢这种大屏幕的手机，开心开心！上7点拔的充电线，现在晚上7点，12个小时过去了，手机还剩百分之70多的电，神奇神奇！
1	拍照是全像素的虽然没有光学防抖但是防抖控制的还是可以的
1	颜值不怎么样，好用，发热很小，相机很好用，反应也快不知道一年后反应会不会慢下来，用一段时间了在追评
1	早就收到了，现在才下班所以我才能研究一下，很满意！特别是goodle play
1	挺好，只是清单上面写的吃鸡神器按键辅助没有。可能忘了吧，我也不吃鸡，所以也就没啥了
0	手机到手感觉很不错，用起来没毛病，很给力
1	挺好的，比官网便宜。一直用的荣耀系列手机。没失望
1	非常喜欢哦！用到现在都很不错，没有什么不满意的。
1	用着觉得不错，以后应该还会买的，一如既往支持国产华为，希望京东一直做正品
1	手机确实是正品，拿到手上给我的感觉很好，就是屏幕上有指纹，电池3400的容量真的很好耐用。
1	很好用，服务态度很好！这个是正品，祝卖家实在
1	很满意  今天刚到货等不及就打开看看，颜色大小都很满意
1	手机速度不错，活动价格买的，挺实惠。
1	手机感觉还不错，很漂亮，反应很快，售后态度也很好，唯一美中不足的就是很容易打电话太久时，上半部分会发烫，咨询客服，说这是正常现象。
0	摄影头太突出了，电池容量也不理想，还好京东服务超一流
1	双十一优惠多，手机好用，拍照清晰，这次购物！很满意
1	手机很漂亮，手感更是没得说，自我感觉非常好
1	屏幕够大，触感很好，总而言之性价比挺高的
-1	买了不到一个月降200元，我的天。血亏啊
1	趁双十一买了，价格合适，手机好看用起来妥妥的
1	没有图，帮老婆去买的。从华为手机出来就一直用，这是我买的第5个华为手机了。相信华为就用华为
1	手机挺好看，很修长，时尚，速度很快！
1	很好，满意
1	运行速度挺快的，功能性还是很不错，相机功能配置比较高
1	用了一段时间了 手机一如即往的好。支持华为 待机时间长
1	昨天下单，今天就收到了，手机大小合适，颜色好看，手感不错，反应很快，照相功能很多，华为没让我失望，很满意的一次购物！
1	的非常好，?
-1	不好用  会卡顿  一分钱一分价
-1	手机不多说，各有各的评价！看看送的耳机吧，一开始我还以为我右耳失聪了！！线都没有我玩个毛？
1	反应很快，外观漂亮，喜欢
-1	客服态度垃圾的一匹，送个货慢得要死，别买
1	手机包装完整，应该是正品。使用非常的流畅，但是本人不在手机上玩游戏，所以玩游戏的话就另说了，但是电池耗费还是比较快的，介意这点的慎入。手机整体性价比很高！
1	不知道评价什么1，统一都说好，很好，非常好！
1	给儿子买的，他说速度快，颜色好，他很喜欢，我们家里全都用华为手机，以后还是一如既往的支持华为。
1	很不错，手机用起来很顺畅。
1	不错，很流畅
1	用了几天  感觉很不错  等用一段时间下来再来追评 真心不错  就是电耗的有点快  不过没事  快充充电也很快
-1	玩个#都能卡死，该说什么好呢
1	手机收到了，手机这个得慢慢测试，有什么问题日后评论。赠送的东西都在，只是手环有点不好，我以为是华为M2系列，原来是乐外M3的，这个以后再说吧！
1	替别人买的 货到了 朋友很喜欢 华为可以 支持华为 物流很快 商家服务很好赞?
-1	感觉不怎么样，吃鸡都卡顿。不知道我这个是不是要例外些
1	物流走了四天，东西终于收到，入手手感和红米Note6pro差不多，但是游戏性能还是很不错，电池很耐用
1	物流很给力啊，手机也很不错，反应杠杠滴，像素也很好，
1	手机很不错哦，用起来不错，好评好评必须的
1	屏幕很大，分辨率不错，外观也不错哦！续航能力非常强大，玩游戏和商户都可以！
1	屏幕大电量足，外观非常好看，玩游戏体验非常好，中度用一天没问题，拍照效果也非常好，一次愉快的购物。
1	用了一天，感觉很不错，手机手感也很好，物流速度不错
1	手机收到，高颜值、速度快，好评！
1	我前天买的今天就收到了，超喜欢这种幻影蓝，像素很高，内存大容量，这下可以随便存储照片不怕卡了，商家还送了很多礼品，一次愉快的购物
1	可以，家里两个荣耀10一个V10了。。。。不过送那些好像只用上了手机壳和钢化膜，，其余的没啥，手机使用正
0	挺轻的 不建议用来吃鸡
-1	刚买了3天就降价   有点不爽
1	手机不错 拍照好看，运行快
0	感觉特别糙
-1	手机还没收到就降价，联系客服爱理不理的
1	华为，大气，有面
1	家态度超级好，东西质量也很好，还贴心的给贴好了哦膜，服务号好，质量好，包装也弄的很好，送的东西也很好贴心，强烈推荐。?
1	为一直都是我的首选，手机很不错，物流直接顺丰也很迅速，老板很贴心，产品很精致。
-1	拍照外围不清楚
1	帮朋友买的，到目前还没出现任何问题，感觉还不错，送过来是原封包装，在过一段时间在来评论！就是收到手机，想拆开看时快递员很不耐烦的样子！
0	手机还是不错的，质量好颜值靓，就是不知道一直存在的续航问题怎么样，希望有所改进，先试用几天再来给反馈。还有一个问题，手机的图片和买到的实物不一样，蓝色京东图片显示紫色，无语了，这种细节错误都能犯也是醉了
1	卖家送了好多东西，体验了一上午，感觉还不错，物有所值，电池也还好，
-1	没有收到货就签收，不可理解。
-1	货速度极慢，简直龟速，四天都没发货，总是以各种理由搪塞，伤心?。机挺好的，但卖家太太太差劲。
1	外观时尚大气，运行速度快，但发现桌面上的日期不能显示农历，希望设计师下款改良
-1	价格欺@
1	很不错，用的非常快，而且效果也不错
1	用着还行，就是电用的很快，可能屏幕太大了吧，总的来说表现好。
1	非常牛逼的手机  好看
0	给我有漏发的东西，我本来不想差评，结果今天第二天手机卡了，我居然重启后才可以用，我就奇了怪了这是新手机吗，唉。
0	充电的速度很快，掉电的速度也很快，处理器也快，总之都很快！
-1	手机不错的，只不过618有点急，京东不像宝一样宝是没有默认选项的而京东相反，所以我颜色买错了，然后客服。。。。。。。刚开始的时候和最后的时候的截图，怪谁呢？就怪客服刚好在我气头上的时候说了这些话吧，火上浇油，哇感觉下次会很少在京东买东西了
1	华为荣耀10，儿子梦寐以求的手机，这下成真的，非常好，但千万别有了手机就忘了读书就行了，好评！
1	非常棒，荣耀挺不错，性能好的没话说，而且这款手机非常好看?适合年轻人怎么拍，怎么放都是一道风景线。京东也是很负责很快送到我的手上。我我是不是第一个收到手机而且评论的，非常荣幸，因为赠送了碎屏险卡还有原装耳机还有一个原装音箱，手动艾特@荣耀手机@京东手机@佳沪电商表示感谢
1	不错，系统流畅，做工精美，一如既往的高性价比，支持国产，支持华为!
1	昨天到的，用了一天再来评价，手感很不错，拍照体验挺好，荣耀系列越来越好了，赞一个！！！?
0	用时手机易发热，质量有什么问题吗？
-1	我想问问，拍照怎么会失真，耗电怎么那么快，，我用荣耀7,荣耀9拍照都很好，耗电还可以！到荣耀10，真是越来越差劲
0	这次买的荣耀十手机非常的好我很喜欢大小很合适也很好用外观很漂亮，手感也。很好。反应也特别快里面的功能也很齐全，有一个。语音助手特别好用，把它选中后对他说话就可以，例如接听电话等等。还有这颗摄像头也很好，有两个拍东西特别的清晰。另外这个荣耀手机的音质也是非常不错的。我用过好几部手机，小米红米，三星另外就是华为华为这是用的第二个手机这几部手机的音质都没有，这个荣耀十这部手机没买错个荣耀十。音质听歌特别舒服。不吵耳朵。有立体感。我是特别喜欢这一点的。总之这次买了荣耀是这部手机。
-1	凉了第一天凉
1	一天收到，总体上还是挺满意的
1	很轻薄，比其他安卓手机好用
1	包装结实可靠，配送非常快，服务很好，已使用，非常流畅
-1	商品缺少配件，没有耳机
1	很好。手机太棒了，超出我想象了
0	游戏耗电较快。天两充吧。
1	还行，没毛病。
1	快就收到货了，发货挺快  早想买这个手机  看到活动马上搞一个，   保证很好  还送了一大堆东西  6
0	手机还可以   打游戏不建议买卡的很真的
1	产品已经收到了，用起来很好。
1	机收到了，用着还行，新机电池续航很棒?
1	手机刚刚收到，还没开始使用送的手机壳和屏保，吃鸡神器都有啦，美中不足就是没有耳机。等用几天啦。再来追评吧。
1	屏幕偏大，返回键，三键组合为一键有不方便的地方，如我想按一次返回桌面？其他都好。
1	长句、短语、邮箱、号码任你自定义！
-1	不知道，今天手机刚到。感觉还行。一般吧里面没有耳机。摄像头里面也是脏的，嗯。也就一般吧。过几天再看一看。
1	手机很好全新是正品不像其他店评论说的什么缝隙大没有这种情况手机样子什么都不错就是拍照不知道是我之前华为P10拍照很好还是什么这个和P10拍照对比起来还是有差距
1	不错的快乐购，秒杀价买的，在网上对比了其他的品牌手机，这款手机无论是外观还是性能价格都非常有优势，手机到货，外观还是性能都没有让我失望，应该能用蛮久。
0	支持#！支持非哥！所以上京东买华为！但是物流太龟速了，所以减俩星星了！
1	运行速度很快，照相功能也很强大，本人不打游戏，就工作上用的最多，比如扫描，上网查资料之类的，上一个华为荣耀7用了3年多，没出过任何毛病，现因内存小所以换个荣耀10，支持你华为。
1	好的手机，支持国产
1	手机使用流畅，暂无卡顿，已验证。赠品**，还不如无有
1	物流超快，昨天下午拍，今天早上就到了。手机刚收到，很满意，荣耀系列性价比高，超值耶！～
0	手机会发烫，其他还可以。
-1	机用了一月多，数据线就坏了！
1	还是很满意，物流也比较快了！
