label	txt
0	机子用的话会好热，烫头的感觉，其他的都还行
0	不是很满意，用了20多天了，才发现背面壳子上有点缝隙，感觉像是二手的，唉，又退不了了，还是将就着用吧。
1	手机外观，配置都挺好的，
1	昨晚买的手机，睡一觉起来了就有手机了，真的很快
1	手机拿到了，用了几天感觉挺不错的，性价比还行！
1	作为华为2000元左右的旗舰机，荣耀10包装上凸显简约大气，时尚感十足，续航能力值得期待，6+128G可以满足一般使用的全部需求。前后高分别率双摄直#我的5D3红圈白头效果。高端PK苹果系，终端领航2000元机，与小米8平分秋色。两千元系的中端机，这两选一个，不会错。
-1	很垃圾的服务体验，整整三天没发货，是眼瞎了才在这里买。
0	不想多说了，手机暂时不表态，但是快递过来的其他赠品，我不管质量到底有多差，就说这包装吧，我原封不动拿出来就是这样子的，看图
1	用了差不多两天了，第一次用华为，有点不习惯这个操作，总体来说还是挺流畅的，。怎么说呢，应该是因为操作习惯的问题，所以感觉是越用越流畅，发热情况还好，很多功能都还在摸索中。我觉得外观真的是很漂亮了，与多数人观点不同的是我觉得刘海挺好看的。耗电量也比较正常合理，希望后续用起来也一样地好用。
-1	刚买完就降价了
-1	东西收到了，手机不错。对物流很失望，着急用看是次日达才从京东买的，结果晚了一天，要不就去店里买了，，京东不想以前值得信赖了，给个差评
0	物流很快，手机用着还行，就是好丑。刘海屏超级难看，细长，比例感觉不协调
1	机已收到，暂时没发现什么不良问题，手感不错，支持华为?
1	贝与描述一致，小孩非常喜欢。还有赠品，点个赞！
1	不错，外观很漂亮，性能也很好，值得购买
1	屏幕大，长度比较长，手大的单手也可以操作。综合来说还是可以的，拍照效果不错，运行上比小米旗舰机差点。指纹解锁很好用。物流不得不说，比京东自营速度慢了很多，好处是有赠品，而且赠品很实用，值得买。
1	使用正常，目前未发现问题，挺好的。送货速度快
-1	原厂贴膜里有气泡，品控需要加强。现在把贴膜撕了使用，但是新机这样还是跟膈应
-1	黑店  卖出厂就有质量问题的手机  买了以后  过了10多天发现手机有绿屏问题（夜间模式  黑暗环境中  手机屏幕上侧和下侧都是绿色花屏）就因为晚到售后几天检测  就以过了15天  不给换  让我修 买了不到一个月  因为出厂就有的质量问题让我修  既然你们按流程来  那我也按流程发表我的使用感受 晚上看个小说刺的眼睛疼 下面有图  要买的请慎重考虑
1	手机非常帅气，送的音响也不错?，非常满意的一次购物，祝老板6.18发发发！
1	国产还是给力的，虽然系统优化差那么一丢丢，整个使用情况是ok的，另外在官网认证是正品。
1	很流畅，屏幕显示也很细腻，感觉是棒棒哒。
1	用了一个月才来评价，性能非常好，性价比高，外观漂亮
1	手机收到用了一天再来评价的。玩游戏不卡特别好。屏幕颜色也好看。想这款特别值
1	不错，够大，下次换手机考虑华为的
1	外观好看，系统运行速度也蛮快，拍照是亮点，期待后期更加精彩的表现！
0	手感不错挺小巧，以前用过荣耀7.这次给个中评，因为手机后盖缝隙太大了，做工太马虎了。没有整体感，运行软件有时候打开软件会迟钝。其它的三分是给国产芯片的，毕竟支持国产。
0	手机发热还没上一个note8好就是外环时尚一点真的
1	拍照还是不错的，发货速度也快，用起来也很舒服，很漂亮好用
1	期待己久的荣耀十已收到。无论外观还是内在运行都不失所望，大小适合，单手操作没没题，值得购买。使用几天再追评吧！
1	屏幕大，电池也耐用，玩游戏特别好用。
0	*牛逼
1	常漂亮，非常大气，黑色更是显得高大上。?
1	手机很不错? 拍照很清晰
0	给差评，下单两天才给我发货的，物流倒是挺快，北京到天津。手机不做评价，原厂机都一个样。
-1	手机充电慢服务态度差
1	不错，手机很好，配置很高，拍照片很清楚，充电也非常快，非常不错
1	手机大小合适，试用了2周，很流程，没有出现过死机。感觉物有所值！
1	非常棒，使用一天没问题。未发现发热。人脸解锁和指纹解锁都很快。
1	外包装均磨破，照相不错！反应也快！颜色也挺棒！手机到手剩111G内存
1	拍照不错，运行流畅，外观美
-1	槽糕的售后服务！！！店大欺客
0	还可以的
1	非常满意，之前用的荣耀V8，两年多了，开始提醒内存不够，还想换华为，看了一遍，最后在荣耀V10和Note10之间选，感觉V10的宽度比之前的V8较窄，加上现在的屏幕比例越来越长，想选屏幕尺寸大一点的，但是又觉得Note10太大了一点，而且比V8重的多，最后选择了Note10，用下来感觉重量还可接受，电池续航很好，很满意，看视频画面很清晰，色彩很亮丽，很满意，这是我和老婆的第四台华为
1	昨天下的单，今天就到了。京东快递就是牛，很厉害，必须点赞。手机挺好的，反应速度快，128G的内存大，终于不用担心手机内存不足的问题了，很喜欢的赠品哦，有耳机，电子手表，两张钢化膜和透明的手机套，今天比昨天降价60块，但是没有赠品。还是很喜欢送的赠品，比心
1	好评，手机很好，很漂亮，我们都很喜欢，支持一下，给个好评……………………好评
1	用了一段时间了，感觉不错，就是耗电有点厉害
1	为手机中国第一品牌，非常满意！
1	外观很大气，刘海屏显得特别漂亮而且手感不错
1	真的没有让我失望，大屏吃鸡神奇，酷爽十足
1	不错很好
1	手机很大，看着比较顺眼。旁边是老手机，5.5寸屏的。
1	用了几天才来评价 手机不错 颜值也很高 充电没有之前用过的OPPO快 好评啦
1	用了一段时间，才回来评价的，手机外观很漂亮，相机拍照很清晰，但是发热问题还是很严重，希望有待改进
1	终于收到手机，非常好看，也很流畅，毕竟麒麟970，喜欢喜欢～
1	先不说别的，首先京东配送员的服务态度特别好，平易近人，比起其他快递那是好的没话说。其次，手机的包装完好无损。运行什么的，用几天再评价！
-1	的东西呢？啥也没有了'
1	给媳妇买的，用了一段时间了，确实不错，很好的一次购物，满分
1	用了两天了，日常方面耗电不多，超声波指纹识别很6，湿手也不怕没反应，而且是屏下指纹没有触感，不会硌手很爽的！
1	一直都是华为的铁杆粉丝，荣耀系列一直都很棒呢！这次的10外型很漂亮呢背面渐变色真的好美！手感也很好，操作起来很流畅，很值得购买呢！
1	处理速度很快，物流也算给力，音质好，正品保证！
1	螢幕很大，用起來順手，這是兩年內推薦朋友與自購買的第六支華為，安卓系統裡華為真的最好用。
1	谢店家送的礼品，手机也是正品，服务超级好，下次还会购
0	和想的差不多吧
0	用半小时就发热了
-1	耳机线都没有配
1	运行流畅，速度快，一点儿不卡，不错
-1	不是好东西一个多月就坏了
-1	什么破手机，手机触屏卡的要死，手机的带电量一天需要充两次以上，这是新手机啊，妈的，赤裸裸的被@了，打游戏的时候，屏显差的要死，都看不清楚，大家还是不要买这个手机了，售后特别不好，不能退货，需要他们判断是不是存在以上问题？要是你自己能判断出来，还用往出买，自己家的商品什么样子，心里没有点B数吗？巨坑无比，
1	了一周来评价一下，一直用荣耀系列，颜值一如既往的好啦?，这款颜色炫酷，相机很好用了，拍出照片很清晰很美，大光圈拍出来的很有高级感，运行速度也不错，赠品多
1	手机不错，就是京东的物流真的不行，，相当慢
1	用了半个月才过来评论，总体来说和线下一个样，问题都不大，可以购买，赠品也是可以的，放心购买
1	手机很好看，用段时间在追评
0	手机外观没得说，我在上传证件照时出现卡屏。
-1	手机是好手机，但是还是第一次买手机不送耳机的，#
1	很中意这款手机！没用多久的新年版OPPO R11S甩手就不用了，外观骚气，手感也是没得说，拍摄效果也是杠杠的，物美价廉，值得拥有！
1	外观漂亮，系统运行流畅，拍照清晰，大爱，客服也很热心。
1	物流太慢了，寄了很多天才到
1	感觉很不错 喜欢 支持国货支持华为！
0	此用户未填写评价内容
1	收到货了，感觉还不错，谢谢老板
-1	手机贼垃圾用两星期就卡死机太懒了，
1	手机收到了，还不错。可商家赠送东西：1、钢化膜与荣耀10不匹配，不厚道，宽度少4mm左右（见图片）；2、该手机一年延保如何确认？
1	效果很好很漂亮，6用过8用过，现在用10，期待荣耀越做越好越大。
-1	#，荣耀Note的配件出现在荣耀10的网页里干嘛呀，让老子白花钱
0	电池耗电太快，摄像头有问题
1	不错 很好用 是全新的 正品 很喜欢
1	很不错的体验，很喜欢，还会考虑再买的。
1	效果很赞，上了工信部网上验了是正品，给个大赞
1	手机还可以，赠品没一个可以用的
1	挺好的手机，这个价位挺合适的，手感很好，很喜欢，而且物流也很快
1	不错的一次购物，赠送的礼品很多，非常喜欢
0	行不错挺流畅 电池续航也可以基本一天一冲重度玩家应该要两充 但是赠送的耳机像强制性*
0	不用不知道，一用吓一跳。表示不想说话了！
1	手机外观很漂亮 系统也不错 运行速度很快
1	手机到手，性价比高用的不错支持华为
0	用了一个月都没有，指纹跟返回键就感应不了了，
-1	说好的七天无理由退换货呢？怎么变成维修了？
1	手机很不错，做工精细屏幕显示细腻，手机大小合适手感不错。下载很快。超棒
0	下单的有点令人心里不舒服
1	手机非常棒，非常喜欢?物美价廉！
1	手机很赞?很漂亮  拆机后惊呆了我的室友
1	精致。希望耐用
1	手机相当不错，漂亮，流行的齐刘海，速度快，
1	很好看，用起来很流畅，反应很快。
-1	我的荣耀10你们却给我送一个p20的膜，不能相信差评
1	手机好用很喜欢?
1	又买了一台荣耀哈哈，可以的呢，真的做工好，外观漂亮
1	非常不错，歪瑞古德，我一直在京东拿的手机，华为国产刚刚的，顶起！
1	买给老妈的手机，一家人都在用很不错她也特别喜欢
1	手机收到用了一段时间感觉真不错运行很快像数也很好很喜欢，我会一直支持国产品牌的
1	还不错，比以前手机强多了
1	用了两天了，感觉很不错。速度又快，外观又美方大方。这是我晚上照的相片，很清晰。
1	价比高，手感极佳，外形喜欢，，作为国产手机设计这样，真心喜欢，！
0	对商品满意，对京东的服务不满意。手机照相效果好，做工不错，女儿想换手机，给她买了一个，使用表明照相效果特别好，系统优化的也很好在。当时买的时候，京东有承诺，价宝保一个月，今天发现，可以领券，能便宜120块，马上联系客服，回复说不在本次活动之内。出尔反尔，说话不算话，
1	手机很好，物流很快满意
1	手机很好用，买来做备用机的
1	手机很不错，蛮喜欢的用下来很不错
1	这是我买的第三个华为荣耀10了。第三个手机，因为用着很舒服，快递也很快，而且这个质量很好，所以就连着买了三台，好评
-1	说句真心话，也就是一般般，以后还是用诺基亚靠普点，一分为品牌
1	手机可以挺流畅，充电挺快的
1	用了一个多星期，感觉各个方面都挺好的，之前用的荣耀8两年半了，因为电池耗电太快才打算换新手机，其他方面都没有任何问题，所以新手机继续支持荣耀系列。
-1	买完就降价400+促销活动，可以的。
1	手机收到还几天了，用了一下效果不错，外观挺好看的，上网速度挺快的，支持国货，整体来说这个性价比还是不错的。
0	手机我觉得还行，之前荣耀6高配，，用了几年不行了，觉得郁闷的就是都是双十一的活动，今天他们一样的价格还送原装耳机，我们一号买的就没有，特别感觉不舒服，给三星！
0	质量不可以
1	手机十分惊艳，做工工艺精致，手感好
0	卡槽很难取出，人脸识别比较慢，说话好送自拍杆也没有，联系电家也不回。第次遇到这样的，所以给差评。
0	发货速度挺快，当天下单当天就收到货了，手机也挺不错的，只是刚收到货两天手机就降了100元，心里堵的慌
-1	卡槽卡死放不了卡有什么用
1	没发现送的耳机在哪儿？
1	这款手机到手一天了  970还是流弊的  同时下十几款软件  同时安装一点也不卡 而且拍照也很方便ai功能很强大  随手拍了一张晚上对面的宿舍楼很清晰
0	首先，我买的这台是正品，没毛病。出现问题后找客服也是反复向我强调手机是正品。没毛病呀。那么问题是什么呢？那就是我买的这台绝对不是官方原装的正品。一开机直接就进入了桌面，没有像其他的新手机那样进入设置界面界面。然后就是桌面天气下显示的地区是深圳的某个区。所以，我这台手机是别人退货后商家拿来二次销售被我买了?。还有一点就是当我向客服反应手机有使用痕迹的时候客服只是一个劲的跟我说是正品，说了几次后直接跟我说不放心可以寄回去。真是的，拐弯抹角的强调是正品，想不起疑心都难。直接跟我说有二次销售的退货品，但手机没有任何问题不就可以了吗？价格比京东自营便宜了250左右，是二次的我也能接受呀？总结一下，便宜这么多一定有诡，但手机功能完全正常没毛病，9.99成新没毛病。不介意的话还是能用的。实在不放心的话还是去买京东自营的吧。（建议商家下次再卖别人退货的手机把手机的使用记录清空咯，发现自己买的是别人退货的心里就是不舒服?）
1	十分好的的东西，很流畅响应速度也很快
1	用过最#的手机一个月就是这个样了
1	很好非常好与实物相符，是正品。
0	用了两天感觉还行。
1	用起顺手，外观大气，非常合心意！
1	质量不错 ，手机很好用 ，还赠了许多东西 ，显示器不错 ，音效也好 ，像素也很高 ，喜欢的朋友赶紧来买吧！
0	就那样吧
1	还不错，挺好用的
1	货已收到 不错不错 是正品 颜色很骚气
0	#预装也太多了。
1	质量不错，运行流畅，屏幕给力
0	买早了，八内存双十一才二千六百五十。。。亏大了
0	用了几天后。。。觉得没有想象中那么好用，而且不知是自己手指头还是屏幕有问题，包括指纹识别也是，反应迟钝。屏幕上滑，下滑要用力拖动屏幕，并有明显卡顿。指纹物理按键自启用后，基本解锁没成功过！耗电快，正常使用一天50～70个电话，到下午就剩25%左右的电量。照相功能还不错，即使在逆光或昏暗情况下拍出来的效果也很清晰！
-1	手机一般般，拿来一星期就开始死机
1	公司作活动，送客戶的，品牌值得信賴，高級有品味，感覺很不錯，贈送手挽和充电宝，值得推薦。
1	手机很不错，非常漂亮，性价比也高，支持国产！
1	小巧精致，反应挺快的，很不错的一款手机。
1	反应速度快，耗电应该还可以接受，我玩游戏也很流畅，办公和上网确实好用，反正比我淘汰的乐视2pro2强多了，我本对手机没有要求，但是用来办公的乐视更新系统后不停推送广告和疯狂掉电之后就想着换一个吧，结果上午买下午就到了用着还不错，关键系统目前用着还行，反应快。第一次用华为手机，对比后盖的玻璃没有苹果的结实。玻璃手感特别好薄薄的。给的赠品的特别使用，都是荣耀的，确实蛮不错的
-1	我就纳闷了为什么没有耳机
1	还不错用着可以
-1	手机还好，服务太差
-1	像二手机
1	为什么贫困最少的毫无怨言涂抹式我去看书了去
1	包装很好，质量很不错。
1	黑色不错，用一段时间上手挺快，打游戏时反应比较快。
1	最喜欢这手机了
1	手机不错。值得吐槽的一点是刘海真的难看。取消沉浸模式好看点。
-1	很完美的手机   最后一次用华为
1	质量还不错，速度好杠杠滴，拍照效果超喜欢。值得拥有。
0	能用好久 自己琢磨 15天 好远啊
1	收到手机觉得挺好用的，很流畅，像素挺好。
1	手机收到打开看了，是正品，好怕是@的咯?
0	手机性能还是可以哒，相机对焦慢，而且还不清晰。总体来说，这部手机适合玩游戏，不适合美颜自拍。
1	物流很快，手感不错，其他试用一个星期后在加评
1	速度快，比9大一点，后壳亮瞎了眼，总体来说很不错
1	颜值高    手机用着也很快     拍照清晰
1	手机颜色很好看，机身也不重，刚刚好，试了一下，系统运行流畅，相机拍照技术好看，音质也很好，关键是真机哟，可以值得入手
1	用了一段时间，目前感觉还不错
0	了就降价，语音质量不行，其他功能还可以，以后应该也不会再买国产机了哈
1	一直从京东买手机，一如既往的好，非常满意，信赖京东，物流也特别的快，头天晚上十一点下的单，第二天上午就到了，快递小哥打电话我没接住，还给我发了个短信，服务态度好
1	用了不久屏幕坏了，正在等待商家维修，如果可以的话，一定好评，手机很好用，很完美，如果一年保修是真的一定大力支持！
1	挺好的，好评，运行速度快。
1	拿到手的那一刻真的震撼到了  从来没用过大屏手机  手感不错  值得购买
0	不错，性价比高，上网也快，打游戏也不会卡，内存也够用
0	新手机超级快充怎么充电充了两个多小时
1	售后服务态度很好，物流也很快，刚刚收到打开看看，很好，用的很流畅，拍照也很清晰，一句华为荣耀10值得你拥有。送的东西也很多。
1	充电很快！使用流畅！快递也挺快的！拍照也不错！
0	下次不买华为手机了卡
1	好用，有金属光泽会变色，运行流畅，相机模式多，成像好，握起来手感没觉得大，可惜用旧机拍新机没出效果。
1	手机很好看，全屏屏幕大，看着比其他手机秀气，系统用着也顺畅，已经推荐给朋友了
1	用了    挺好的
-1	不行，建议大家不要买
0	我好心塞！！！！各种慢。手机发货慢。手机到货后一个月配件才到已经离开广东省回海南跟卖家说还不能改地址，只能让同事寄过来给我。我都不知道为什么京东发货这么慢
0	几天就双11买的，结果便宜这么多！
1	手机今天收到了，服务挺好的，用一段时间在说手机怎么样
0	还可以，这个价格每年涨不因该是国产企业做的事啊，赚了钱还是要回馈一下自己人吧?
1	非常好，手机也挺好，物流也挺快，服务满意，下次还会买
1	感觉卖家发货特别快，而且手机运行很快
0	手机颜值没得说，好看并且拍照很厉害就是不防抖，游戏体验不好容易卡，虽然升级了吓人技术但是感觉还是卡，耗电量比较快，总之希望能尽快升级系统。物流快递还是可以的，很快。
0	总体还是不错的，配置比较齐全，红外、NFC，耳机孔都有，指纹前置。荣耀10应该再小一点，这样可以手握得很好。指纹识别较慢，这跟识别方式有关。最大的问题是呼吸灯，太小了。
1	手机运行很快，手感也好，漂亮，不错的手机，值得购买。
1	手感很不错，很流畅，用起来也方便，很不错的一次选择！
1	很喜欢啊，超漂亮，小刘海设置简直可爱死了，谢谢卖家！
1	手机已收到，目前使用正常，颜色非常好看，昨天拿note10和mate20max比较了一下，虽然mate20是莱卡镜头，但是好像note10更亮一点。哎?刚收到货就又降了60元！后面使用一下看看，再做追评。
1	手机很好用，打游戏不卡，颜值很高，拍照很清晰，店家也送了很多小礼物。
1	华为越来越不错，机子很漂亮
1	手机运行速度挺快的，拿在手里挺舒服，好像背面都是蓝色，没有多重颜色效果！
-1	货要五天到，客服不爱理，内心很焦灼，可是没人理。
1	运行速度快，屏幕大，看着舒服，商家送了礼物，总体很满意。
1	物流很快，东西也很全，总的来说挺不错，机子要等用几天在评价
-1	手机很好，卖家的诚信需要重新考量，客服态度极差
-1	不到一个月，降价100多，京东给不给补差价
1	东西很好，买给弟弟的，很喜欢
1	手机速度非常快，ai智能，很好用。储存空间够大，再也不用担心储存空间不够用了。
1	特别好也是正品不是翻新机
1	用了一段时间才来评价，整体效果挺好，用着很舒服，外观也好看
-1	快递慢，服务很一般，包装不好
0	机玩了没多会，就挺烫的。
1	电池还可以外观也好看总体还不错
1	用了几天才评价的，手机质量不错，一直用华为手机，感觉不错，
1	物流快。是正品，拿在手上，轻巧，手感很好。赞一个。
1	这才第二天就开始卡顿起来了，无力吐槽了
-1	电池不怎么好    买了二十多天又降价了
1	货收到了，立刻使用了，手感好，速度块，人脸识别，物流也很快都给好评
1	拿来就用了一下，什么都很好 没有出现什么不正常的反应  值得拥有
0	拍照效果一般般，其他的还要慢慢看，等后续在做评价。
0	手机刚收到颜色好看，手感很好，用过再来追评。
0	6G运存 竟然微信卡了 我服
1	手机很流畅比我的荣耀7强的杠杠的
1	手机用的挺好的
1	手机质量好，打游戏也不卡
1	玩游戏半天一充，照相效果不错，手机速度也可以。总体不错吧
1	收到手机用了几天感觉很好用，直
-1	对华为的低端手机无感，高端机……可以参考一年前的P10，通过他们当时的爱用用不用滚的公关，也感受到华为的商家本性暴露无遗。还好只是给女生买的，我不用，而且我也没花钱，她现在用的倒是挺开心的。一年之后能卡成啥样就不清楚了。
1	非常不错，屏幕真大，真爽，玩游戏一点不卡，画质清晰，身边朋友也买了几台，手机散热控制很好，
1	质量非常好，与卖家描述的完全一致，全家都非常满意,真的很喜欢你家东西，完全超出期望值，发货速度非常快，包装非常仔细、严实，物流公司服务态度很好，运送速度很快，很满意的一次购物哟，掌柜加油！京东真好。
1	很好手机！照像尤其好，比苹果x都强。
1	用了几天啦，续航能力还行，充电确实快，升级了GPU Turbo 玩游戏确实流畅，画质不错。
0	外观漂亮，和P20很相似。但手机容易发烫！
1	用了一段时间，感觉运行还可以，外观很漂亮，拿在手里感觉挺舒服的
1	我们家一直用华为，相信它，下次还要回购。
-1	跑电严重  关机状态也能跑百分之十五的电
1	目前没有负面影响，希望得心应手！
0	手机一般
1	手机不错，好久没用黑色手机啦，黑色外观效果挺好，屏幕、照相效果明显比上代产品好，电池续航也不错?
1	双十一买的，价格还可以，送货快。手机质量不错，值得拥有
1	递很快，手机质量很好，速度也快，很喜欢，点个赞！
-1	手机到货一个星期左右膜气泡了  客服瞎了似的一直不说话 也不理
1	手机用了十来天才来评价的。挺好的。满意。
1	手机挺不错的
1	手机很好，拿到手查生产日期二十天左右，满意！
1	还不错质量不错，物流快，还是大品牌质量可靠。
1	很好，我是从6+64换的6+128
-1	三年不用安卓了，看了一些新闻，以为安卓手机可以了，买了用了才知道，还是那尿性，流畅度不如我三年前买的6s，呵呵，以后还是用iPhone吧，最后一个安卓手机，没有零分评价？！
-1	~不能录小视频
1	手机性价比非常高
